[
  {
    "id": "vehicleimagery-porsche-badge-2026-05-09",
    "assetTypes": [
      "badge"
    ],
    "url": "https://vehicleimagery.com/manufactures/porsche_logo.svg",
    "retrievedAt": "2026-05-09",
    "sourceKind": "vehicleimagery-reference-svg-review-fallback",
    "licenceNotes": "Vehicle Imagery SVG used as review-fallback candidate geometry only; replace with official manufacturer SVG before marking approved.",
    "checksumSha256": "32f2634bdf6101b562f3636493a76e21b673a0bc186a4dcb03690d3aedc99708",
    "evidencePath": "docs/evidence/vehicleimagery-fallback-import-2026-05-09.md",
    "notes": "Reference classification likely-badge; upstream filename does not prove mark semantics. Current-brand review required."
  }
]
