[
  {
    "id": "vehicleimagery-cadillac-badge-2026-05-09",
    "assetTypes": [
      "badge"
    ],
    "url": "https://vehicleimagery.com/manufactures/cadillac_logo.svg",
    "retrievedAt": "2026-05-09",
    "sourceKind": "vehicleimagery-reference-svg-review-fallback",
    "licenceNotes": "Vehicle Imagery SVG used as review-fallback candidate geometry only; replace with official manufacturer SVG before marking approved.",
    "checksumSha256": "995039db057d2814ff300b56908b465fee54d7c5a446ac6c856f77859fb53cd3",
    "evidencePath": "docs/evidence/vehicleimagery-fallback-import-2026-05-09.md",
    "notes": "Reference classification likely-badge; upstream filename does not prove mark semantics. Current-brand review required."
  }
]
