[
  {
    "id": "vehicleimagery-jaguar-wordmark-2026-05-09",
    "assetTypes": [
      "wordmark"
    ],
    "url": "https://vehicleimagery.com/manufactures/jaguar_logo.svg",
    "retrievedAt": "2026-05-09",
    "sourceKind": "vehicleimagery-reference-svg-review-fallback",
    "licenceNotes": "Vehicle Imagery SVG used as review-fallback candidate geometry only; replace with official manufacturer SVG before marking approved.",
    "checksumSha256": "2c85a1694de56450551ed630464c53383bf7aacdc6268b20ff5ac26866ca3c03",
    "evidencePath": "docs/evidence/vehicleimagery-fallback-import-2026-05-09.md",
    "notes": "Reference classification likely-wordmark; upstream filename does not prove mark semantics. Current-brand review required."
  }
]
