[
  {
    "id": "vehicleimagery-lamborghini-badge-2026-05-09",
    "assetTypes": [
      "badge"
    ],
    "url": "https://vehicleimagery.com/manufactures/lamborghini_logo.svg",
    "retrievedAt": "2026-05-09",
    "sourceKind": "vehicleimagery-reference-svg-review-fallback",
    "licenceNotes": "Vehicle Imagery SVG used as review-fallback candidate geometry only; replace with official manufacturer SVG before marking approved.",
    "checksumSha256": "f2341806c0d0ca794b094e1ae781f2ce7e95f535228c40d52bdc6daf1aad83eb",
    "evidencePath": "docs/evidence/vehicleimagery-fallback-import-2026-05-09.md",
    "notes": "Reference classification likely-badge; upstream filename does not prove mark semantics. Current-brand review required."
  }
]
