[
  {
    "id": "vehicleimagery-mercury-badge-2026-05-09",
    "assetTypes": [
      "badge"
    ],
    "url": "https://vehicleimagery.com/manufactures/mercury_logo.svg",
    "retrievedAt": "2026-05-09",
    "sourceKind": "vehicleimagery-reference-svg-review-fallback",
    "licenceNotes": "Vehicle Imagery SVG used as review-fallback candidate geometry only; replace with official manufacturer SVG before marking approved.",
    "checksumSha256": "e148eb30b8b325420a5a19e69e12d06f4327bb66d31fb6d42bb5b9a05359e649",
    "evidencePath": "docs/evidence/vehicleimagery-fallback-import-2026-05-09.md",
    "notes": "Reference classification likely-badge; upstream filename does not prove mark semantics. Current-brand review required."
  }
]
