[
  {
    "id": "vehicleimagery-bentley-wordmark-2026-05-09",
    "assetTypes": [
      "wordmark"
    ],
    "url": "https://vehicleimagery.com/manufactures/bentley_logo.svg",
    "retrievedAt": "2026-05-09",
    "sourceKind": "vehicleimagery-reference-svg-review-fallback",
    "licenceNotes": "Vehicle Imagery SVG used as review-fallback candidate geometry only; replace with official manufacturer SVG before marking approved.",
    "checksumSha256": "8df37558554e88266aa60cc747ab1365fe383d043c95b8ca7ed292da27d14006",
    "evidencePath": "docs/evidence/vehicleimagery-fallback-import-2026-05-09.md",
    "notes": "Reference classification likely-wordmark; upstream filename does not prove mark semantics. Current-brand review required."
  }
]
