[
  {
    "id": "vehicleimagery-subaru-badge-2026-05-09",
    "assetTypes": [
      "badge"
    ],
    "url": "https://vehicleimagery.com/manufactures/subaru_logo.svg",
    "retrievedAt": "2026-05-09",
    "sourceKind": "vehicleimagery-reference-svg-review-fallback",
    "licenceNotes": "Vehicle Imagery SVG used as review-fallback candidate geometry only; replace with official manufacturer SVG before marking approved.",
    "checksumSha256": "acaf3bc9c4e3d42fd3255e559a4fff29993ddc74090394734b366a02d880289d",
    "evidencePath": "docs/evidence/vehicleimagery-fallback-import-2026-05-09.md",
    "notes": "Reference classification likely-badge; upstream filename does not prove mark semantics. Current-brand review required."
  }
]
